call_id,tool_name,display_name,family,purpose,permission_class,house_placement,exposure_tier,version,endpoint_protocol,billing_class,trust_tier,latency_ms,cost_weight,success_contract,failure_contract,sdk_dependencies,laws_enforced,status
TOOL-001,PULSE-KEEPER,Pulse Keeper,Context,Monitor and report organism heartbeat pulse at the 873ms cadence,organism.pulse.read,Sovereign Ring,INTERNAL,1.0.0,intelligence-wire/pulse-keeper,free,low,873,0,Returns current heartbeat status with beat number and uptime,Returns status dead if heartbeat is not running,@medina/organism-runtime-sdk,AL-019,active
TOOL-002,SYNC-WEAVER,Sync Weaver,Commander,Synchronize organism endpoints using phi-resonance Kuramoto coupling,organism.sync.write,Sovereign Ring,INTERNAL,1.0.0,intelligence-wire/sync-weaver,free,medium,100,2,Returns current synchronization state with order parameter R,Returns error if no oscillators registered or coupling fails,"@medina/organism-runtime-sdk","AL-019 / AL-035",active
TOOL-003,FLOW-MONITOR,Flow Monitor,Crawling,Monitor data flow throughput and detect bottlenecks across all organism rings,organism.flow.read,Transport Ring,INTERNAL,1.0.0,intelligence-wire/flow-monitor,free,low,200,1,Returns flow status with throughput metrics and active channel count,Returns status blocked if all channels are saturated,@medina/intelligence-routing-sdk,"AL-005 / AL-014",active
TOOL-004,STATE-GUARDIAN,State Guardian,Context,Read validate and protect 4-register organism state integrity,organism.state.read,Sovereign Ring,INTERNAL,1.0.0,intelligence-wire/state-guardian,free,high,50,1,Returns state snapshot with status ok when all registers are valid,Returns status violation with array of violations when state integrity is broken,@medina/organism-runtime-sdk,"AL-005 / AL-006 / AL-007 / AL-020",active
TOOL-005,CYCLE-COUNTER,Cycle Counter,Context,Count and report organism lifecycle cycles — boot pulse settle rest and shutdown,organism.lifecycle.read,Sovereign Ring,INTERNAL,1.0.0,intelligence-wire/cycle-counter,free,low,50,0,Returns total cycle count and current lifecycle phase,Returns error if lifecycle tracking is unavailable,@medina/organism-runtime-sdk,AL-019,active
TOOL-006,INFER-ENGINE,Infer Engine,Commander,Route inference tasks to the optimal AI model by capability priority and cost,organism.inference.execute,Interface Ring,INTERNAL_SOVEREIGN,1.0.0,intelligence-wire/infer-engine,metered,medium,200,5,Returns the optimal model selection with score and alternatives,Returns status no-match if no model meets the requirements,"@medina/intelligence-routing-sdk / @medina/ai-model-engines","AL-025 / AL-026",active
TOOL-007,PATTERN-SEEKER,Pattern Seeker,Crawling,Detect recurring patterns across organism data streams and memory lineage,organism.analysis.read,Memory Ring,INTERNAL,1.0.0,intelligence-wire/pattern-seeker,free,medium,500,3,Returns detected patterns with frequency scores and confidence levels,Returns status no-patterns if no significant patterns detected,@medina/sovereign-memory-sdk,"AL-022 / AL-023",active
TOOL-008,CONTEXT-BUILDER,Context Builder,Context,Assemble rich execution context from organism state memory and environment,organism.context.read,Interface Ring,INTERNAL_SOVEREIGN,1.0.0,intelligence-wire/context-builder,metered,medium,300,2,Returns assembled context object with estimated token size,Returns status partial if some context sources unavailable,"@medina/organism-runtime-sdk / @medina/sovereign-memory-sdk","AL-004 / AL-020",active
TOOL-009,ATTENTION-ROUTER,Attention Router,Commander,Route attention and focus across organism subsystems by urgency,organism.routing.write,Interface Ring,INTERNAL,1.0.0,intelligence-wire/attention-router,free,medium,100,2,Returns attention distribution map with focus target,Returns status overloaded if attention cannot be allocated,@medina/intelligence-routing-sdk,"AL-025 / AL-027",active
TOOL-010,MEMORY-CONSOLIDATOR,Memory Consolidator,Context,Consolidate organism memories — merge branches prune stale entries and compact,organism.memory.write,Memory Ring,INTERNAL,1.0.0,intelligence-wire/memory-consolidator,metered,high,1000,5,Returns before/after memory counts with branches merged,Returns error if memory store is locked or unavailable,@medina/sovereign-memory-sdk,"AL-022 / AL-023 / AL-024",active
TOOL-011,SENTINEL-WATCH,Sentinel Watch,Sentry,Real-time security monitoring — prompt injection phishing toxicity and PII detection,organism.security.read,Counsel Ring,INTERNAL,1.0.0,intelligence-wire/sentinel-watch,free,critical,150,3,Returns threat level assessment with details of any detected threats,Returns error if security scanning is unavailable,@medina/ai-model-engines,"AL-010 / AL-011",active
TOOL-012,INTEGRITY-CHECKER,Integrity Checker,Sentry,Verify data integrity contract compliance and schema consistency,organism.integrity.read,Proof Ring,INTERNAL,1.0.0,intelligence-wire/integrity-checker,free,high,500,2,Returns integrity check results with pass/fail counts and violation details,Returns error if integrity checking system is unavailable,,"AL-010 / AL-011 / AL-020",active
TOOL-013,BOUNDARY-ENFORCER,Boundary Enforcer,Sentry,Enforce organism boundaries — ring isolation and cross-ring communication validation,organism.boundary.write,Counsel Ring,INTERNAL,1.0.0,intelligence-wire/boundary-enforcer,free,critical,100,2,Returns boundary enforcement status with breach details,Returns error if boundary enforcement system is unavailable,,"AL-001 / AL-014 / AL-015",active
TOOL-014,ANOMALY-DETECTOR,Anomaly Detector,Crawling,Detect anomalies in organism behavior — unexpected state changes and unusual latency,organism.analysis.read,Sovereign Ring,INTERNAL,1.0.0,intelligence-wire/anomaly-detector,free,medium,300,3,Returns anomaly detection results with deviation scores,Returns error if baseline data is insufficient,@medina/organism-runtime-sdk,"AL-033 / AL-034",active
TOOL-015,SEAL-VERIFIER,Seal Verifier,Sentry,Verify cryptographic seals on intelligence contracts and data packages,organism.security.read,Counsel Ring,INTERNAL_SOVEREIGN,1.0.0,intelligence-wire/seal-verifier,metered,critical,100,2,Returns verification result with seal details,Returns status tampered if seal integrity is compromised,,"AL-010 / AL-011",active
TOOL-016,RESOURCE-BALANCER,Resource Balancer,Commander,Balance compute memory and network resources across organism rings,organism.resources.write,Sovereign Ring,INTERNAL,1.0.0,intelligence-wire/resource-balancer,free,high,200,3,Returns balanced resource allocation map with utilization metrics,Returns status exhausted if resources cannot be allocated,@medina/organism-runtime-sdk,"AL-033 / AL-036",active
TOOL-017,CONNECTION-POOL,Connection Pool,Commander,Manage connection pools for enterprise connectors and intelligence wires,organism.connections.read,Transport Ring,INTERNAL,1.0.0,intelligence-wire/connection-pool,free,medium,100,1,Returns pool status with connection counts and available capacity,Returns status saturated if all pools are at capacity,@medina/enterprise-integration-sdk,"AL-014 / AL-028",active
TOOL-018,CACHE-OPTIMIZER,Cache Optimizer,Crawling,Optimize caching across organism memory layers — coherence and eviction,organism.cache.write,Memory Ring,INTERNAL,1.0.0,intelligence-wire/cache-optimizer,free,medium,150,2,Returns cache status with hit rate and entry counts,Returns status cold if cache is empty or freshly reset,@medina/sovereign-memory-sdk,"AL-016 / AL-017",active
TOOL-019,QUEUE-PROCESSOR,Queue Processor,Sentry,Process organism task queues — priority queues for invocations and settlement,organism.queue.write,Transport Ring,INTERNAL,1.0.0,intelligence-wire/queue-processor,free,medium,200,2,Returns queue status with depth and processing metrics,Returns status full if queue capacity is exhausted,@medina/intelligence-routing-sdk,AL-015,active
TOOL-020,LOG-STREAMER,Log Streamer,Crawling,Stream organism logs in real-time — structured entries from all layers,organism.logs.read,Transport Ring,INTERNAL,1.0.0,intelligence-wire/log-streamer,free,low,100,1,Returns structured log entries matching the filter criteria,Returns status empty if no logs match the filter,,,active
TOOL-021,TOPOLOGY-CRAWLER,Topology Crawler,Crawling,Crawl organism topology — discover rings wires extensions protocols SDKs and tools,organism.topology.read,Sovereign Ring,INTERNAL,1.0.0,intelligence-wire/topology-crawler,free,medium,800,4,Returns full topology graph with node/edge counts and orphan detection,Returns status unreachable if organism root or start node cannot be reached,"@medina/organism-runtime-sdk / @medina/intelligence-routing-sdk","AL-001 / AL-034 / AL-037",active
TOOL-022,LINEAGE-TRACER,Lineage Tracer,Context,Trace full lineage of organism entities — memories state transitions and decision paths,organism.lineage.read,Memory Ring,INTERNAL,1.0.0,intelligence-wire/lineage-tracer,free,medium,400,3,Returns full ancestor chain with fork points and root entity,Returns status not-found if entity ID does not exist in lineage store,@medina/sovereign-memory-sdk,"AL-022 / AL-023 / AL-024",active
TOOL-023,DOCTRINE-AUDITOR,Doctrine Auditor,Sentry,Audit organism behavior against 40 architectural laws and sovereign doctrine,organism.governance.read,Counsel Ring,INTERNAL_SOVEREIGN,1.0.0,intelligence-wire/doctrine-auditor,metered,critical,600,4,Returns compliance score with per-law violation details and evidence,Returns status critical-drift if fundamental doctrine alignment is broken,@medina/organism-runtime-sdk,"AL-021 / AL-037 / AL-038 / AL-039 / AL-040",active
TOOL-024,TASK-COMMANDER,Task Commander,Commander,Orchestrate multi-step task plans across tools agents and extensions with rollback,organism.command.execute,Interface Ring,INTERNAL_SOVEREIGN,1.0.0,intelligence-wire/task-commander,metered,high,1000,8,Returns execution ID with per-step results and progress tracking,Returns status failed with partial results and rollback option,"@medina/intelligence-routing-sdk / @medina/organism-runtime-sdk","AL-025 / AL-027 / AL-036",active
TOOL-025,PROTOCOLLUM-ENGINE,Protocols Auto-Generator,Builder,Auto-generate organism protocol definitions and wire schemas from doctrine specifications,organism.sovereign,Sovereign Ring,INTERNAL_SOVEREIGN,1.0.0,intelligence-wire/protocollum-engine,metered,high,350,6,Returns generated protocol schema with validation results and wire binding,Returns error if doctrine specification is malformed or sovereign seal is missing,"@medina/organism-runtime-sdk / @medina/intelligence-routing-sdk","AL-019 / AL-050 / AL-051",active
TOOL-026,TERMINALIS-ENGINE,Terminal Intelligence Generator,Builder,Generate terminal intelligence endpoints and CLI wire bindings for organism interactions,organism.sovereign,Interface Ring,INTERNAL,1.0.0,intelligence-wire/terminalis-engine,metered,medium,250,4,Returns generated terminal bindings with endpoint map and CLI schema,Returns error if terminal configuration is invalid or binding conflicts detected,@medina/organism-runtime-sdk,"AL-025 / AL-044",active
TOOL-027,ORGANISMUS-ENGINE,SDK Organism Generator,Builder,Generate organism SDK packages with runtime bindings and sovereign memory integration,organism.sovereign,Sovereign Ring,INTERNAL_SOVEREIGN,1.0.0,intelligence-wire/organismus-engine,metered,critical,500,7,Returns generated SDK manifest with module tree and dependency graph,Returns error if organism schema is inconsistent or sovereign contract violated,"@medina/organism-runtime-sdk / @medina/sovereign-memory-sdk","AL-019 / AL-020 / AL-033",active
TOOL-028,MERCATOR-ENGINE,Marketplace Tool Generator,Builder,Generate marketplace tool registrations and call routing entries for the organism ecosystem,organism.sovereign,Interface Ring,INTERNAL_SOVEREIGN,1.0.0,intelligence-wire/mercator-engine,metered,high,300,5,Returns generated marketplace entries with routing map and billing configuration,Returns error if tool schema conflicts with existing registry entries,"@medina/organism-runtime-sdk / @medina/intelligence-routing-sdk","AL-052 / AL-053",active
TOOL-029,ORCHESTRATOR-ENGINE,Model Family Orchestrator,Builder,Orchestrate AI model family selection and routing across multi-provider intelligence endpoints,organism.sovereign,Sovereign Ring,INTERNAL_SOVEREIGN,1.0.0,intelligence-wire/orchestrator-engine,metered,high,400,6,Returns model orchestration plan with provider selection and fallback chain,Returns error if no model providers are available or routing constraints unresolvable,"@medina/intelligence-routing-sdk / @medina/ai-model-engines","AL-025 / AL-047",active
TOOL-030,MATHEMATICUS-ENGINE,Math Constants Generator,Builder,Generate mathematical constants and phi-resonance calibration values for organism operations,organism.internal,Memory Ring,INTERNAL,1.0.0,intelligence-wire/mathematicus-engine,free,medium,50,0,Returns computed constants with precision metadata and resonance calibration values,Returns error if precision requirements exceed computational bounds,@medina/organism-runtime-sdk,"AL-008 / AL-009",active
TOOL-031,SYNAPTICUS-ENGINE,Synapse Connection Generator,Builder,Generate synapse connection maps and neural wire bindings between organism subsystems,organism.sovereign,Transport Ring,INTERNAL,1.0.0,intelligence-wire/synapticus-engine,metered,high,300,5,Returns synapse connection graph with binding strength and activation thresholds,Returns error if connection topology creates circular dependencies or isolation breaches,"@medina/intelligence-routing-sdk / @medina/organism-runtime-sdk","AL-035 / AL-059",active
TOOL-032,SUBSTRATUM-ENGINE,Blockchain Layer Generator,Builder,Generate blockchain substrate layers with consensus mechanisms and settlement protocols,organism.sovereign,Proof Ring,INTERNAL_SOVEREIGN,1.0.0,intelligence-wire/substratum-engine,premium,critical,800,9,Returns generated blockchain layer with consensus config and settlement endpoints,Returns error if consensus parameters are invalid or chain state is inconsistent,"@medina/organism-runtime-sdk / @medina/enterprise-integration-sdk","AL-058 / AL-014",active
TOOL-033,UNIVERSUM-ENGINE,Ecosystem Domain Generator,Builder,Generate ecosystem domain boundaries and cross-domain routing rules for organism expansion,organism.sovereign,Sovereign Ring,INTERNAL_SOVEREIGN,1.0.0,intelligence-wire/universum-engine,metered,high,450,6,Returns domain topology with boundary definitions and cross-domain routing map,Returns error if domain conflicts detected or expansion violates sovereign doctrine,"@medina/organism-runtime-sdk / @medina/intelligence-routing-sdk","AL-021 / AL-029",active
TOOL-034,CANISTRUM-ENGINE,Canister Factory Generator,Builder,Generate canister factory deployments with wasm compilation and state isolation for smart contracts,organism.sovereign,Proof Ring,INTERNAL_SOVEREIGN,1.0.0,intelligence-wire/canistrum-engine,premium,critical,900,9,Returns compiled canister package with deployment manifest and state isolation proof,Returns error if wasm compilation fails or state isolation constraints violated,"@medina/organism-runtime-sdk / @medina/enterprise-integration-sdk","AL-058 / AL-036",active
TOOL-035,LICENTIATOR-ENGINE,License Rights Generator,Builder,Generate license grants and rights management entries for organism marketplace partners,organism.sovereign,Counsel Ring,PARTNER,1.0.0,intelligence-wire/licentiator-engine,metered,high,200,4,Returns license grant with rights matrix and partner entitlement configuration,Returns error if license terms conflict or partner verification fails,"@medina/organism-runtime-sdk / @medina/enterprise-integration-sdk","AL-021 / AL-052",active
TOOL-036,DEFENSOR-ENGINE,Defense Arsenal Generator,Builder,Generate defense arsenal configurations with threat detection rules and incident response playbooks,organism.sovereign,Counsel Ring,INTERNAL_SOVEREIGN,1.0.0,intelligence-wire/defensor-engine,metered,critical,250,6,Returns defense configuration with threat rules and response playbook bindings,Returns error if threat model is incomplete or response chain has gaps,"@medina/organism-runtime-sdk / @medina/ai-model-engines","AL-033 / AL-041 / AL-043",active
TOOL-037,PROTOCOL-FUSION-ROUTER,Protocol Model Fusion Router,Commander,Fuse protocol definitions with AI model capabilities for cross-domain intelligent routing,organism.command.execute,Sovereign Ring,INTERNAL_SOVEREIGN,1.0.0,intelligence-wire/protocol-fusion-router,metered,high,300,6,Returns fused routing plan with protocol-model binding map and optimization score,Returns error if protocol schema is incompatible with available model capabilities,"@medina/intelligence-routing-sdk / @medina/ai-model-engines","AL-025 / AL-050",active
TOOL-038,OBSERVER-AI-SCANNER,Observer Intelligence Scanner,Crawling,Scan and observe organism subsystem behaviors for intelligence pattern recognition,organism.analysis.read,Sovereign Ring,INTERNAL,1.0.0,intelligence-wire/observer-ai-scanner,free,medium,200,1,Returns observed behavior patterns with anomaly flags and confidence scores,Returns error if observation targets are unreachable or scan window expired,@medina/organism-runtime-sdk,"AL-033 / AL-034",active
TOOL-039,WORKER-ORCHESTRATOR,Web Worker Orchestrator,Commander,Orchestrate web worker threads for parallel task execution across organism subsystems,organism.command.execute,Interface Ring,INTERNAL,1.0.0,intelligence-wire/worker-orchestrator,metered,medium,150,3,Returns worker allocation map with thread status and task distribution,Returns error if worker pool is exhausted or thread isolation violated,@medina/intelligence-routing-sdk,"AL-025 / AL-036",active
TOOL-040,KNOWLEDGE-GRAPH-ENGINE,Knowledge Graph Engine,Context,Build and query knowledge graphs from organism memory and contextual data sources,organism.context.read,Memory Ring,INTERNAL_SOVEREIGN,1.0.0,intelligence-wire/knowledge-graph-engine,metered,high,400,5,Returns knowledge graph query results with entity relationships and traversal paths,Returns error if graph store is unavailable or query exceeds complexity bounds,"@medina/sovereign-memory-sdk / @medina/organism-runtime-sdk","AL-022 / AL-023",active
TOOL-041,AUTONOMOUS-AGENT-PLANNER,Autonomous Agent Planner,Commander,Plan and coordinate autonomous agent workflows with multi-step goal decomposition,organism.command.execute,Sovereign Ring,INTERNAL_SOVEREIGN,1.0.0,intelligence-wire/autonomous-agent-planner,premium,critical,600,8,Returns agent execution plan with step graph and rollback checkpoints,Returns error if goal decomposition fails or agent constraints are unsatisfiable,"@medina/intelligence-routing-sdk / @medina/organism-runtime-sdk","AL-025 / AL-027 / AL-033",active
TOOL-042,SUBSTRATE-BRIDGE-RELAY,Substrate Bridge Relay,Commander,Relay cross-chain bridge transactions between blockchain substrates with finality guarantees,organism.command.execute,Proof Ring,INTERNAL_SOVEREIGN,1.0.0,intelligence-wire/substrate-bridge-relay,premium,critical,700,9,Returns bridge transaction receipt with finality proof and settlement confirmation,Returns error if cross-chain verification fails or finality timeout exceeded,"@medina/enterprise-integration-sdk / @medina/organism-runtime-sdk","AL-058 / AL-014",active
TOOL-043,SECURITY-ARSENAL-SCANNER,Security Arsenal Scanner,Sentry,Scan organism attack surfaces and evaluate security posture across all defense layers,organism.security.read,Counsel Ring,INTERNAL,1.0.0,intelligence-wire/security-arsenal-scanner,metered,high,350,4,Returns security posture report with vulnerability scores and remediation priorities,Returns error if scan targets are inaccessible or threat intelligence feed unavailable,"@medina/organism-runtime-sdk / @medina/ai-model-engines","AL-010 / AL-041",active
TOOL-044,MARKETPLACE-REGISTRY-MANAGER,Marketplace Registry Manager,Builder,Manage marketplace tool registry entries with versioning and deprecation lifecycle support,organism.sovereign,Interface Ring,INTERNAL_SOVEREIGN,1.0.0,intelligence-wire/marketplace-registry-manager,metered,high,250,4,Returns registry operation result with updated tool manifest and version history,Returns error if registry entry conflicts with existing tools or version is invalid,"@medina/organism-runtime-sdk / @medina/intelligence-routing-sdk","AL-052 / AL-053",active
TOOL-045,EMERGENCE-DETECTOR,Emergence Detector,Crawling,Detect emergent behaviors and self-organizing patterns across organism subsystem interactions,organism.analysis.read,Sovereign Ring,INTERNAL,1.0.0,intelligence-wire/emergence-detector,free,medium,500,2,Returns emergence analysis with pattern classification and complexity metrics,Returns error if observation window is insufficient or baseline data unavailable,@medina/organism-runtime-sdk,"AL-033 / AL-034",active
TOOL-046,LAW-ENFORCEMENT-WIRE,Law Enforcement Wire,Sentry,Enforce architectural law compliance in real-time across organism operations and state transitions,organism.governance.read,Counsel Ring,INTERNAL_SOVEREIGN,1.0.0,intelligence-wire/law-enforcement-wire,metered,critical,100,3,Returns enforcement verdict with per-law compliance status and violation evidence,Returns error if law registry is unavailable or enforcement chain is broken,@medina/organism-runtime-sdk,"AL-021 / AL-037 / AL-038",active
TOOL-047,MULTI-MODEL-CONSENSUS,Multi-Model Consensus Engine,Commander,Coordinate cross-model consensus by aggregating outputs from multiple AI providers,organism.command.execute,Interface Ring,INTERNAL_SOVEREIGN,1.0.0,intelligence-wire/multi-model-consensus,premium,critical,800,9,Returns consensus result with per-model votes and confidence aggregation,Returns error if quorum threshold unmet or model provider responses timed out,"@medina/intelligence-routing-sdk / @medina/ai-model-engines","AL-025 / AL-026 / AL-047",active
TOOL-048,PHI-RESONANCE-COORDINATOR,Phi Resonance Coordinator,Context,Coordinate phi-resonance synchronization parameters across organism oscillator networks,organism.pulse.read,Sovereign Ring,INTERNAL,1.0.0,intelligence-wire/phi-resonance-coordinator,free,medium,100,1,Returns resonance status with order parameter and oscillator phase distribution,Returns error if oscillator network is partitioned or coupling constants diverge,@medina/organism-runtime-sdk,"AL-008 / AL-035",active
TOOL-049,HEARTBEAT-HEALTH-MONITOR,Heartbeat Health Monitor,Context,Monitor organism heartbeat health metrics and report degradation or failure conditions,organism.pulse.read,Sovereign Ring,INTERNAL,1.0.0,intelligence-wire/heartbeat-health-monitor,free,low,50,0,Returns heartbeat health status with pulse regularity and degradation indicators,Returns status critical if heartbeat has stopped or interval exceeds tolerance,@medina/organism-runtime-sdk,AL-019,active
TOOL-050,DOCTRINE-COMPLIANCE-AUDITOR,Doctrine Compliance Auditor,Sentry,Audit all organism operations against sovereign doctrine with evidence collection and scoring,organism.governance.read,Counsel Ring,INTERNAL_SOVEREIGN,1.0.0,intelligence-wire/doctrine-compliance-auditor,sovereign,critical,700,7,Returns compliance audit report with per-doctrine scores and evidence trails,Returns error if doctrine registry is unavailable or audit scope exceeds capacity,@medina/organism-runtime-sdk,"AL-021 / AL-037 / AL-039 / AL-040",active
TOOL-051,CROSS-WORKER-MESSENGER,Cross Worker Messenger,Commander,Route messages between organism web workers with guaranteed delivery and ordering,organism.routing.write,Transport Ring,INTERNAL,1.0.0,intelligence-wire/cross-worker-messenger,free,medium,80,1,Returns delivery receipt with message sequence number and routing path,Returns error if target worker is unreachable or message queue is full,@medina/intelligence-routing-sdk,"AL-014 / AL-015",active
TOOL-052,ENTITY-DEDUPLICATOR,Entity Deduplicator,Crawling,Detect and merge duplicate entities across organism memory stores and knowledge graphs,organism.memory.write,Memory Ring,INTERNAL,1.0.0,intelligence-wire/entity-deduplicator,metered,medium,400,3,Returns deduplication results with merged entity count and conflict resolution log,Returns error if memory store is locked or merge conflicts cannot be auto-resolved,@medina/sovereign-memory-sdk,"AL-022 / AL-024",active
TOOL-053,PROMPT-SHIELD,Prompt Shield,Sentry,Detect and block prompt injection attacks across all organism inference endpoints,organism.security.read,Counsel Ring,INTERNAL,1.0.0,intelligence-wire/prompt-shield,free,critical,60,1,Returns threat assessment with injection probability score and blocked payload hash,Returns error if shield model is unavailable or input exceeds scan capacity,@medina/ai-model-engines,"AL-010 / AL-011 / AL-043",active
TOOL-054,PII-SENTINEL,PII Sentinel,Sentry,Detect and redact personally identifiable information in organism data flows and outputs,organism.security.read,Counsel Ring,INTERNAL,1.0.0,intelligence-wire/pii-sentinel,free,critical,75,1,Returns PII scan results with detected entity types and redaction map,Returns error if PII detection model is unavailable or data format unsupported,@medina/ai-model-engines,"AL-010 / AL-011",active
TOOL-055,CAPABILITY-SCORER,Capability Scorer,Context,Score and rank AI model capabilities against task requirements for optimal selection,organism.inference.execute,Interface Ring,INTERNAL_SOVEREIGN,1.0.0,intelligence-wire/capability-scorer,metered,high,200,3,Returns capability scores with ranked model list and task-fit analysis,Returns error if model registry is unavailable or scoring criteria are undefined,"@medina/intelligence-routing-sdk / @medina/ai-model-engines","AL-025 / AL-026",active
TOOL-056,BIAS-AUDITOR,Bias Auditor,Sentry,Detect and report bias patterns in AI model outputs and organism decision pathways,organism.governance.read,Counsel Ring,INTERNAL_SOVEREIGN,1.0.0,intelligence-wire/bias-auditor,metered,high,450,5,Returns bias audit report with fairness metrics and flagged decision paths,Returns error if audit data is insufficient or model outputs are inaccessible,@medina/ai-model-engines,"AL-010 / AL-039",active
